{
  "benchmark_configuration": {
    "blob_sha256": "41fa161e39748d72325be3c87d53a3cfca32aea32cce8c26e29c5d4122582708",
    "commit": "1313131313131313131313131313131313131313",
    "path": "generated/two_plus_two/config.json",
    "permitted_axioms": [
      "Classical.choice",
      "propext"
    ],
    "problem_id": "two_plus_two",
    "repository": "leanprover/lean-eval",
    "statement_revision": 1
  },
  "encoding": "utf8_ndjson",
  "exporter": {
    "binary_sha256": "bbbbbbbbbbbbbbbbbbbbbbbbbbbbbbbbbbbbbbbbbbbbbbbbbbbbbbbbbbbbbbbb",
    "commit": "15f6055e299ad5b89345e533cc2192f4cc00f659",
    "format_specification_sha256": "f82a21e17e4258a1043895d0653ea4333bef8cb07aad2e3d6c1fc4be52b138e3",
    "format_specification_path": "format_ndjson.md",
    "name": "lean4export",
    "repository": "leanprover/lean4export",
    "version": "0.1.0"
  },
  "format_version": "3.1.0",
  "input_sha256": "7d1ca64c0b12707ed286aab6fefbd3fde2301baf72712e83bcc4981105ef1afd",
  "input_size_bytes": 214,
  "kind": "kernel_solution_export_input",
  "lean": {
    "githash": "aaaaaaaaaaaaaaaaaaaaaaaaaaaaaaaaaaaaaaaa",
    "toolchain": "leanprover/lean4:v4.33.0",
    "version": "4.33.0"
  },
  "replay_attempt": 1,
  "replay_task_id": "rt1_1111111111111111111111111111111111111111111111111111111111111111",
  "result_id": "r2_2222222222222222222222222222222222222222222222222222222222222222",
  "schema_version": 1,
  "source_free": true,
  "terminal_evidence": {
    "report_entry_sha256": "3333333333333333333333333333333333333333333333333333333333333333",
    "terminal_event_sha256": "4444444444444444444444444444444444444444444444444444444444444444",
    "terminal_verdict_sha256": "5555555555555555555555555555555555555555555555555555555555555555"
  }
}
